{
  "derived_model_version": "0.1.0",
  "artifact_type": "DocumentEdition",
  "regulator_profile": "ich",
  "records": [
    {
      "document_edition_id": "slice.s6.edition.integrated_package",
      "guidance_family_id": "slice.s6.family",
      "edition_label": "ICH S6(R1) Integrated Parent Guideline and Addendum",
      "edition_role": "integrated_package",
      "jurisdiction": "ICH",
      "publication_date": null,
      "effective_date": null,
      "document_status": "in_force",
      "current_risk_assessment_id": null,
      "review_status": "needs_review",
      "profile_details": null
    }
  ]
}
